{
  "schema": "signalbox.health-report/v2",
  "id": "report-private-rowan-unknown-101",
  "profile_ref": "mintie-private-rowan",
  "profile_revision": 3,
  "producer_ref": "reference/mintie-observer",
  "subject_ref": "gateway/rowan-private",
  "generation_epoch": "sample-epoch-alpha",
  "generation": 101,
  "attempt_id": "attempt-private-rowan-101",
  "started_at": "2026-08-31T10:00:00Z",
  "completed_at": "2026-08-31T10:00:06Z",
  "published_at": "2026-08-31T10:00:07Z",
  "valid_until": "2026-08-31T10:20:00Z",
  "outcome": "unknown",
  "dimensions": {
    "transport": {"state": "unknown", "observations": [{"probe_ref": "neutral-https", "evidence_class": "transport-neutral", "dependency_group": "neutral-connectivity", "state": "pass", "observed_at": "2026-08-31T10:00:01Z"}, {"probe_ref": "rowan-private-lane", "evidence_class": "role-specific", "dependency_group": "rowan-private-policy", "state": "unknown", "observed_at": "2026-08-31T10:00:03Z", "reason_code": "query-failed"}]},
    "exit-identity": {"state": "unknown", "observations": [{"probe_ref": "rowan-private-identity", "evidence_class": "role-specific", "dependency_group": "rowan-private-policy", "state": "unknown", "observed_at": "2026-08-31T10:00:04Z", "reason_code": "query-failed"}]},
    "dns": {"state": "pass", "observations": [{"probe_ref": "canonical-origin-resolution", "evidence_class": "resolver-path", "dependency_group": "mintie-resolver", "state": "pass", "observed_at": "2026-08-31T10:00:06Z"}]}
  }
}
