{
  "schema": "signalbox.health-report/v2",
  "id": "report-lane-alder-pass-101",
  "profile_ref": "mintie-egress-alder",
  "profile_revision": 3,
  "producer_ref": "reference/mintie-observer",
  "subject_ref": "role-binding/alder",
  "generation_epoch": "sample-epoch-alpha",
  "generation": 101,
  "attempt_id": "attempt-lane-alder-101",
  "started_at": "2026-08-31T10:00:00Z",
  "completed_at": "2026-08-31T10:00:06Z",
  "published_at": "2026-08-31T10:00:07Z",
  "valid_until": "2026-08-31T10:20:00Z",
  "outcome": "pass",
  "dimensions": {
    "transport": {"state": "pass", "observations": [{"probe_ref": "neutral-https", "evidence_class": "transport-neutral", "dependency_group": "neutral-connectivity", "state": "pass", "observed_at": "2026-08-31T10:00:01Z"}, {"probe_ref": "alder-lane", "evidence_class": "role-specific", "dependency_group": "alder-egress-policy", "state": "pass", "observed_at": "2026-08-31T10:00:03Z"}]},
    "exit-identity": {"state": "pass", "observations": [{"probe_ref": "alder-policy", "evidence_class": "role-specific", "dependency_group": "alder-egress-policy", "state": "pass", "observed_at": "2026-08-31T10:00:04Z"}]},
    "dns": {"state": "pass", "observations": [{"probe_ref": "alder-resolver", "evidence_class": "resolver-path", "dependency_group": "mintie-resolver", "state": "pass", "observed_at": "2026-08-31T10:00:06Z"}]}
  }
}
